{
 "case": "source-gateway-classification",
 "category": "classification",
 "expected": {
  "role_30d": "INBOUND_GATEWAY"
 },
 "inputs": {
  "forward_count_30d": 2,
  "lifetime_role": "OUTBOUND_GATEWAY",
  "sourced_forward_count_30d": 40,
  "total_forward_count_30d": 42,
  "window_30d_available": true
 },
 "requirement": "Retained reporting: inbound-gateway role derives from 30d sourced flow",
 "schema_name": "conformance_case",
 "schema_version": 0,
 "source": "tests/golden/fixtures/profitability/role30d_gateway_30d_dominant_sourced.json"
}
